[{"schema":"contrepoint/preuve/2","id":"67708569db7b3c2bfd37deddede8d889157b2867b9d57bce5757b640db2551fd","famille":"votes","entite":"groupe.an17.ecos","valeur":-0.98,"valeur_code":null,"echelle":{"id":"votes_an17_ancre_v1","min":-1.00,"max":1.00,"decimales":2,"libelle":"Votes XVIIe législature, unités médianes ancrées"},"motif_code":null,"motif":null,"dispersion":{"effectif":38,"iqr":0.03,"ecart_type_reechantillonnage":0.01},"observation":{"debut":"2024-10-08","fin":"2026-07-21"},"date_source":"2026-08-27","date_calcul":"2026-08-27T00:00:00Z","methode":{"id":"votes_rang1_ancre","version":"1.0.0","parametres":{"ancre_droite":"groupe.an17.rn","ancre_gauche":"groupe.an17.lfi-nfp","codage":"pour=+1;contre=-1;abstention=0;non_votant=manquant;absent=manquant","filtre_scrutins":"minorite_non_vide","iterations_als":300,"scrutins_ecartes":455,"scrutins_retenus":7979}},"epingles":[],"entrees":[{"source":"an_scrutins_17","url":"https://data.assemblee-nationale.fr/static/openData/repository/17/loi/scrutins/Scrutins.json.zip","producteur":"Assemblée nationale","derniere_mise_a_jour":"2026-08-27","citation":null,"empreinte_sha256":"7bcf6f4ab9f62d1457caeedad42a5a73b7a5e50a879653a19b23c02ff62f344b","empreinte_contenu_sha256":"c8457f346220b5b7fb673bd1f273ef8c3296b7ff2769524bf5024c9d95c7e65c","recupere_le":"2026-08-28"},{"source":"registre_partis","url":"https://raw.githubusercontent.com/bourbask/contrepoint/v0.3.0/data/registre/partis.json","producteur":"Contrepoint","derniere_mise_a_jour":"2026-08-27","citation":null,"empreinte_sha256":"b7bdb819be8b6773a8af5d2a939a78120e710e6f3cf6e86e87db0443168aaf2b","empreinte_contenu_sha256":"b7bdb819be8b6773a8af5d2a939a78120e710e6f3cf6e86e87db0443168aaf2b","recupere_le":"2026-08-27"},{"source":"an_organe","url":"https://data.assemblee-nationale.fr/static/openData/repository/17/amo/tous_acteurs_mandats_organes_xi_legislature/AMO30_tous_acteurs_tous_mandats_tous_organes_historique.json.zip","producteur":"Assemblée nationale","derniere_mise_a_jour":"2026-08-27","citation":null,"empreinte_sha256":"bbecd01274d2bc9f46fcaa276b06868862ae7680131da3162e35b5cbef663061","empreinte_contenu_sha256":"0f49c00a8227d6cb8e658d374bacfec35238fe4e2dd6305f7df6ac4f515c5de6","recupere_le":"2026-08-27"}],"logiciel":{"version":"0.1.0","commit":null}}]
