[{"schema":"contrepoint/preuve/2","id":"8bfeaefa4cfcc36a6ceba41a6fb7bdff6bbbaa5ae2ab7175ba9e02bdc27332f8","famille":"administratif","entite":"parti.lr","valeur":null,"valeur_code":"LR","echelle":{"id":"nuance_leg2024","min":null,"max":null,"decimales":null,"libelle":"Ministère de l'intérieur — code de nuance, législatives 2024"},"motif_code":null,"motif":null,"dispersion":null,"observation":{"debut":"2024-06-30","fin":"2024-07-07"},"date_source":"2024-07-10","date_calcul":"2026-08-27T00:00:00Z","methode":{"id":"nuance_constatee","version":"1.0.0","parametres":{"colonne":"Nuance candidat","reference_grille":"IOMA2415630C du 2024-06-11","tour":"2"}},"epingles":[],"entrees":[{"source":"registre_partis","url":"https://raw.githubusercontent.com/bourbask/contrepoint/v0.3.0/data/registre/partis.json","producteur":"Contrepoint","derniere_mise_a_jour":"2026-08-27","citation":null,"empreinte_sha256":"b7bdb819be8b6773a8af5d2a939a78120e710e6f3cf6e86e87db0443168aaf2b","empreinte_contenu_sha256":"b7bdb819be8b6773a8af5d2a939a78120e710e6f3cf6e86e87db0443168aaf2b","recupere_le":"2026-08-27"},{"source":"nuance_leg2024","url":"https://static.data.gouv.fr/resources/elections-legislatives-des-30-juin-et-7-juillet-2024-resultats-definitifs-du-2nd-tour/20240710-170536/resultats-definitifs-par-region.csv","producteur":"Ministère de l'intérieur","derniere_mise_a_jour":"2024-07-10","citation":null,"empreinte_sha256":"f8552401cffade4397fa501f161c961d377d629235d9f9a813ecb11ad5ba0c50","empreinte_contenu_sha256":"f8552401cffade4397fa501f161c961d377d629235d9f9a813ecb11ad5ba0c50","recupere_le":"2026-08-28"}],"logiciel":{"version":"0.1.0","commit":null}}]
