[{"schema":"contrepoint/preuve/2","id":"f1d50006f315cce759f37b539e4c91de190403f7fe894c2bda47a5a707ab008e","famille":"experts","entite":"parti.lr","valeur":7.73,"valeur_code":null,"echelle":{"id":"ches_lrgen_0_10","min":0.00,"max":10.00,"decimales":2,"libelle":"CHES 2024, variable lrgen, échelle 0 à 10"},"motif_code":null,"motif":null,"dispersion":null,"observation":{"debut":"2024-01-01","fin":"2024-12-31"},"date_source":"2026-08-04","date_calcul":"2026-08-27T00:00:00Z","methode":{"id":"ches_lrgen","version":"1.0.0","parametres":{"colonne":"lrgen","pays":6,"vague":"2024"}},"epingles":[],"entrees":[{"source":"ches_2024","url":"https://github.com/chesdata/chesdata.github.io/releases/download/ches-europe/CHES_2024_final_v2.csv","producteur":"Chapel Hill Expert Survey","derniere_mise_a_jour":"2026-08-04","citation":"Rovny, Jan, Jonathan Polk, Ryan Bakker, Liesbet Hooghe, Seth Jolly, Gary Marks, Marco Steenbergen, and Milada Anna Vachudova. 2025. \"The 2024 Chapel Hill Expert Survey on political party positioning in Europe: Twenty-five years of party positional data.\" Electoral Studies 97 (October). doi:10.1016/j.electstud.2025.102981","empreinte_sha256":"1c1ec0532afa2a0a13317122cbbe40eb9ff35425191892d1fff24fbef6acc6a8","empreinte_contenu_sha256":"1c1ec0532afa2a0a13317122cbbe40eb9ff35425191892d1fff24fbef6acc6a8","recupere_le":"2026-08-28"},{"source":"registre_partis","url":"https://raw.githubusercontent.com/bourbask/contrepoint/v0.3.0/data/registre/partis.json","producteur":"Contrepoint","derniere_mise_a_jour":"2026-08-27","citation":null,"empreinte_sha256":"b7bdb819be8b6773a8af5d2a939a78120e710e6f3cf6e86e87db0443168aaf2b","empreinte_contenu_sha256":"b7bdb819be8b6773a8af5d2a939a78120e710e6f3cf6e86e87db0443168aaf2b","recupere_le":"2026-08-27"}],"logiciel":{"version":"0.1.0","commit":null}}]
