[{"schema":"contrepoint/preuve/2","id":"bc43670379beca4893ae45df9c34ef66cb7ab1ecd16aa04b7e916ea8496c9ecb","famille":"votes","entite":"groupe.an17.soc","valeur":-0.8352,"valeur_code":null,"echelle":{"id":"votes_an17_ancre_v1","min":-1.0,"max":1.0,"decimales":2,"libelle":"Votes XVIIe législature, unités médianes ancrées"},"motif_code":null,"motif":null,"dispersion":{"effectif":70,"iqr":0.057,"ecart_type_reechantillonnage":0.0098},"observation":{"debut":"2024-10-08","fin":"2026-07-21"},"date_source":"2026-08-27","date_calcul":"2026-08-27T00:00:00Z","methode":{"id":"votes_rang1_ancre","version":"1.0.0","parametres":{"ancre_droite":"groupe.an17.rn","ancre_gauche":"groupe.an17.lfi-nfp","codage":"pour=+1;contre=-1;abstention=0;non_votant=manquant;absent=manquant","filtre_scrutins":"minorite_non_vide","iterations_als":300,"scrutins_ecartes":455,"scrutins_retenus":7979}},"epingles":[],"entrees":[{"source":"an_scrutins_17","url":"https://data.assemblee-nationale.fr/static/openData/repository/17/loi/scrutins/Scrutins.json.zip","producteur":"Assemblée nationale","derniere_mise_a_jour":"2026-08-27","citation":null,"empreinte_sha256":"7bcf6f4ab9f62d1457caeedad42a5a73b7a5e50a879653a19b23c02ff62f344b","empreinte_contenu_sha256":"c8457f346220b5b7fb673bd1f273ef8c3296b7ff2769524bf5024c9d95c7e65c","recupere_le":"2026-08-28"},{"source":"registre_partis","url":"https://raw.githubusercontent.com/bourbask/contrepoint/v0.3.0/data/registre/partis.json","producteur":"Contrepoint","derniere_mise_a_jour":"2026-08-27","citation":null,"empreinte_sha256":"b7bdb819be8b6773a8af5d2a939a78120e710e6f3cf6e86e87db0443168aaf2b","empreinte_contenu_sha256":"b7bdb819be8b6773a8af5d2a939a78120e710e6f3cf6e86e87db0443168aaf2b","recupere_le":"2026-08-27"},{"source":"an_organe","url":"https://data.assemblee-nationale.fr/static/openData/repository/17/amo/tous_acteurs_mandats_organes_xi_legislature/AMO30_tous_acteurs_tous_mandats_tous_organes_historique.json.zip","producteur":"Assemblée nationale","derniere_mise_a_jour":"2026-08-27","citation":null,"empreinte_sha256":"bbecd01274d2bc9f46fcaa276b06868862ae7680131da3162e35b5cbef663061","empreinte_contenu_sha256":"0f49c00a8227d6cb8e658d374bacfec35238fe4e2dd6305f7df6ac4f515c5de6","recupere_le":"2026-08-27"}],"logiciel":{"version":"0.1.0","commit":null}},{"schema":"contrepoint/preuve/2","id":"bc4e6cb448438201e8723f8a56cb65dbbe0cfbecfa1b0b0bd94932a4653c3f13","famille":"administratif","entite":"coalition.nfp","valeur":null,"valeur_code":"UG","echelle":{"id":"nuance_leg2024","min":null,"max":null,"decimales":null,"libelle":"Ministère de l'intérieur — code de nuance, législatives 2024"},"motif_code":null,"motif":null,"dispersion":null,"observation":{"debut":"2024-06-30","fin":"2024-07-07"},"date_source":"2024-07-10","date_calcul":"2026-08-27T00:00:00Z","methode":{"id":"nuance_constatee","version":"1.0.0","parametres":{"colonne":"Nuance candidat","reference_grille":"IOMA2415630C du 2024-06-11","tour":"2"}},"epingles":[],"entrees":[{"source":"registre_partis","url":"https://raw.githubusercontent.com/bourbask/contrepoint/v0.3.0/data/registre/partis.json","producteur":"Contrepoint","derniere_mise_a_jour":"2026-08-27","citation":null,"empreinte_sha256":"b7bdb819be8b6773a8af5d2a939a78120e710e6f3cf6e86e87db0443168aaf2b","empreinte_contenu_sha256":"b7bdb819be8b6773a8af5d2a939a78120e710e6f3cf6e86e87db0443168aaf2b","recupere_le":"2026-08-27"},{"source":"nuance_leg2024","url":"https://static.data.gouv.fr/resources/elections-legislatives-des-30-juin-et-7-juillet-2024-resultats-definitifs-du-2nd-tour/20240710-170536/resultats-definitifs-par-region.csv","producteur":"Ministère de l'intérieur","derniere_mise_a_jour":"2024-07-10","citation":null,"empreinte_sha256":"f8552401cffade4397fa501f161c961d377d629235d9f9a813ecb11ad5ba0c50","empreinte_contenu_sha256":"f8552401cffade4397fa501f161c961d377d629235d9f9a813ecb11ad5ba0c50","recupere_le":"2026-08-28"}],"logiciel":{"version":"0.1.0","commit":null}}]
